<?xml version="1.0" encoding="utf-8"?>
<!DOCTYPE transducer SYSTEM "transducer.dtd">
<transducer>
  
  <signature-in>
    <symbol name="g" arity="2"/>
    <symbol name="a" arity="0"/>
    <symbol name="b" arity="0"/>    
  </signature-in>
  
  <signature-out>
    <symbol name="g" arity="2"/>
    <symbol name="a" arity="0"/>
    <symbol name="b" arity="0"/>   
  </signature-out>
  
  
  <states> 
    <state name="1"/>
    <state name="2"/>
  </states>
  
  <axiom>
    <call state="1" variable="1"/>
  </axiom>
  
  <rules>
    
    <rule state="1" symbol="g">
      <call state="2" variable="2" />
    </rule>
    
    <rule state="2" symbol="a">
      <context symbol="a"/>
    </rule>
    
    <rule state="2" symbol="b">
      <context symbol="b"/>
    </rule>
    
    <rule state="2" symbol="g">
      <context symbol="g">
        <call state="2" variable="1" />
        <call state="2" variable="2" />
      </context>
    </rule>
    
  </rules>
  
</transducer>

