<?xml version="1.0" encoding="utf-8"?>
<!DOCTYPE transducer SYSTEM "transducer.dtd">
<transducer>
  
  <signature-in>
    <symbol name="f" arity="2"/>
    <symbol name="u" arity="1"/>
    <symbol name="a" arity="0"/>
    <symbol name="b" arity="0"/>    
  </signature-in>
  
  <signature-out>
    <symbol name="a" arity="0"/>
    <symbol name="b" arity="0"/>   
  </signature-out>
  
  
  <states> 
    <state name="1"/>
  </states>
  
  <axiom>
    <call state="1" variable="1"/>
  </axiom>
  
  <rules>
    
    <rule state="1" symbol="u">
      <call state="1" variable="1" />
    </rule>
    
    <rule state="1" symbol="a">
      <context symbol="a"/>
    </rule>
    
    <rule state="1" symbol="b">
      <context symbol="b"/>
    </rule>
    
    <rule state="1" symbol="f">
      <call state="1" variable="1"/>
    </rule>
    
  </rules>
  
</transducer>

