<?xml version="1.0" encoding="utf-8"?>
<!DOCTYPE transducer SYSTEM "transducer.dtd">
<transducer>
  
  <signature-in>
    <symbol name="f" arity="2"/>
    <symbol name="u" arity="1"/>
    <symbol name="a" arity="0"/>
    <symbol name="b" arity="0"/>    
  </signature-in>
  
  <signature-out>
    <symbol name="g" arity="3"/>
    <symbol name="f" arity="2"/>
    <symbol name="u" arity="1"/>
    <symbol name="a" arity="0"/>
    <symbol name="b" arity="0"/>   
  </signature-out>
  
  
  <states> 
    <state name="1"/>
    <state name="2"/>
    <state name="3"/>
    <state name="4"/>
  </states>
  
  <axiom>
    <context symbol = "g">
      <call state="1" variable="1"/>
      <call state="2" variable="1"/>
      <call state="3" variable="1"/>
    </context>
  </axiom>
  
  <rules>
    
    <rule state="1" symbol="u">
      <context symbol="u">
        <call state="1" variable="1" />
      </context>
    </rule>
    
    <rule state="1" symbol="a">
      <context symbol="a"/>
    </rule>
    
    <rule state="1" symbol="b">
      <context symbol="b"/>
    </rule>
    
    <rule state="2" symbol="f">
      <context symbol="f">
        <call state="4" variable="1"/>
        <call state="4" variable="2"/>
      </context>
    </rule>
    
    <rule state="4" symbol="f">
      <context symbol="f">
        <call state="2" variable="1"/>
        <call state="2" variable="2"/>
      </context>
    </rule>
    
    <rule state="2" symbol="u">
      <context symbol="u">
        <call state="4" variable="1"/>
      </context>
    </rule>
    
    <rule state="4" symbol="u">
      <context symbol="u">
        <call state="2" variable="1"/>
      </context>
    </rule>
    
    <rule state="4" symbol="b">
      <context symbol="b"/>
    </rule>
    
    <rule state="4" symbol="a">
      <context symbol="a"/>
    </rule>
    
    <rule state="3" symbol="f">
      <context symbol="f">
        <call state="3" variable="1"/>
        <call state="3" variable="2"/>
      </context>
    </rule>
    
    <rule state="3" symbol="u">
      <context symbol="u">
        <call state="3" variable="1"/>
      </context>
    </rule>
    
    <rule state="3" symbol="b">
      <context symbol="b"/>
    </rule>
    
  </rules>
  
</transducer>

